{
  "task_name": "kenya-sc-judgment-analysis",
  "jurisdiction": "kenya",
  "legal_system": ["common_law"],
  "reasoning_type": "factual_evidence_analysis",
  "languages": ["en"],
  "dataset": [
    {
      "id": "ke-long-001",
      "input": "EXCERPT from the Supreme Court of Kenya Advisory Opinion in In re the Matter of the National Land Commission [2014] eKLR:\n\n'The question referred to this court is whether the National Land Commission (NLC) and the Ministry of Lands have concurrent jurisdiction over the management of public land. The Constitution establishes distinct institutions with distinct mandates.\n\nArticle 67(2) of the Constitution confers on the NLC the function to 'manage public land on behalf of the national and county governments.' Article 62 defines public land and establishes that it is held by the national government in trust for the people of Kenya.\n\nThe Land Registration Act 2012 confers upon the Ministry of Lands the function of registration of title to land. The Land Act 2012 sets out the framework for land administration.\n\nThese are not concurrent functions. The NLC manages public land (making decisions about its use, allocation, and disposition). The Ministry registers land titles (recording ownership in the register). A decision to allocate public land by the NLC must be followed by registration of the title by the Ministry. Each institution must exercise its constitutionally assigned function.\n\nThe question of concurrent jurisdiction does not arise. The NLC and the Ministry exercise distinct, complementary functions in the land administration chain. Conflict arises only where one institution attempts to usurp the function of the other.'\n\nBased on this excerpt, what is the distinction between 'management' and 'registration' of land as articulated by the Supreme Court, and how does this resolve the jurisdictional conflict?",
      "target": "Distinction: (a) 'Management' under Article 67(2) of the Constitution refers to the NLC's function to make substantive decisions about public land — including allocation, disposition, user and revocation of grants. This is a decision-making function involving the exercise of discretion and policy choices. (b) 'Registration' under the Land Registration Act 2012 refers to the Ministry's function to record and maintain the official register of title — including recording the NLC's allocation decisions, issuing title deeds, and maintaining the cadastre. This is an administrative/recording function.\n\nResolution of jurisdictional conflict: The two functions are not concurrent but sequential and complementary. The NLC decides who gets public land and on what terms; the Ministry registers that decision in the land register. Conflict arises only where the Ministry purports to make allocation decisions (encroaching on NLC's function) or where the NLC purports to issue title deeds (encroaching on the Ministry's function). The Constitution creates a 'land administration chain' where each institution must operate within its sphere. This resolves the conflict by establishing that neither institution has supremacy over the other — they are co-equal in their respective spheres.",
      "source": "In re the Matter of the National Land Commission [2014] eKLR (Advisory Opinion Reference No. 2 of 2014)"
    },
    {
      "id": "ke-long-002",
      "input": "EXCERPT from the Court of Appeal of Kenya judgment in Mumo Matemu v Trusted Society of Human Rights Alliance [2013] eKLR:\n\n'The appellant raised a preliminary objection that the respondent lacked locus standi to challenge his appointment as Chairman of the Ethics and Anti-Corruption Commission. The appellant argued that under the former Constitution, locus standi in constitutional matters was restricted to persons whose civil rights and obligations were directly affected. The High Court upheld this objection and struck out the petition.\n\nOn appeal, the issue is whether Article 22 of the Constitution 2010 has changed the law on locus standi. In our view, it has fundamentally changed it. Article 22(1) provides: 'Every person has the right to institute court proceedings claiming that a right or fundamental freedom in the Bill of Rights has been denied, violated or infringed, or is threatened.'\n\nArticle 22(2) explicitly expands this right to include: (a) persons acting on behalf of others; (b) persons acting in the public interest; (c) associations acting in the interest of members.\n\nThe restrictive common law rules that required a direct personal interest have been displaced by the Constitution's expansive standing regime. The rigid rule in Adesanya v President of Nigeria (which required a plaintiff to show that their civil rights and obligations were directly affected) no longer represents the law in Kenya under our 2010 Constitution.\n\nHowever, this does not mean that any person can challenge any matter as a mere busybody. The court retains the discretion to ensure that the applicant has a genuine interest in the matter and is not abusing the process. But the threshold is low — the Constitution prefers access to justice over procedural barriers.\n\nThe appeal by Mr Matemu is dismissed. The respondent had locus standi to bring the petition.'\n\nBased on this excerpt, how has Article 22 of the Constitution 2010 changed the law of standing in Kenya, and what safeguard remains against abuse?",
      "target": "Change in the law of standing: Article 22 fundamentally broadened standing in constitutional matters from a narrow 'direct personal interest' test to a liberal standing regime. Under the former Constitution, a litigant had to prove that their own civil rights and obligations were directly affected. Article 22(1) now gives every person the right to institute proceedings claiming a violation of the Bill of Rights. Article 22(2) explicitly recognises: (a) representative standing (acting on behalf of another); (b) public interest standing; and (c) associational standing (an association acting for its members). The Kenyan Constitution goes further than most — it expressly constitutionalises public interest litigation, removing the need for courts to develop this through common law.\n\nSafeguard against abuse: The court retains an inherent discretion to ensure the litigant has a 'genuine interest' and is not a 'mere busybody.' However, the threshold is low and the court should prefer access to justice over procedural barriers. The court must balance the constitutional preference for broad access against the need to protect the court's process from abuse. The standard is that the litigant must demonstrate sufficient interest — not that their rights must be directly affected.",
      "source": "Mumo Matemu v Trusted Society of Human Rights Alliance [2013] eKLR; Constitution of Kenya 2010, art. 22"
    }
  ]
}
